{
    "$schema": "./schemas/target-surface-catalog.schema.json",
    "schemaVersion": 1,
    "completeness": "partial",
    "publicApiIds": [
        "adapter.assert-store",
        "adapter.read",
        "adapter.read-hydration-snapshot",
        "adapter.subscribe",
        "adapter.v1-subpath",
        "beta.cache-companion",
        "beta.inspect-flight-recorder",
        "beta.inspect-react-correlation",
        "beta.search",
        "collection.artifact-export",
        "collection.artifact-import",
        "collection.artifacts-subpath",
        "collection.materialization-status",
        "collection.materialization-subscribe",
        "collection.materialize",
        "collection.materialize-options.priority",
        "collection.operations-subpath",
        "collection.scan",
        "core.atom",
        "core.atom.lazy",
        "core.atom-options.equal",
        "core.atom-options.name",
        "core.callback-capability-error",
        "core.collection",
        "core.collection-options.encode-key",
        "core.collection-options.indexes",
        "core.dormant-external-read-error",
        "core.external-atom",
        "core.external-atom-options.name",
        "core.external-source-delivery-limit-error",
        "core.external-source-non-convergence-error",
        "core.facet-options.mode",
        "core.facet-options.order",
        "core.family",
        "core.family-options.encode-key",
        "core.invalid-atom-comparator-result-error",
        "core.invalid-collection-key-error",
        "core.invalid-synchronous-atom-value-error",
        "core.invalid-synchronous-collection-value-error",
        "core.invalid-transaction-callback-result-error",
        "core.invalid-transaction-target-error",
        "core.global-atom",
        "core.global-store",
        "core.presence",
        "core.query-definition.facets",
        "core.query-definition.limit",
        "core.query-definition.offset",
        "core.query-definition.order-by",
        "core.query-definition.where",
        "core.runtime-mismatch-error",
        "core.missing-collection-row-error",
        "core.scope-not-found-error",
        "core.server-snapshot-unavailable-error",
        "core.selector",
        "core.selector-capability-error",
        "core.selector-options.equal",
        "core.selector-options.name",
        "core.selector-circular-dependency-error",
        "core.selector-evaluation-error",
        "core.settle-limit-error",
        "core.store",
        "core.store-disposed-error",
        "core.store-tree-mismatch-error",
        "core.store.delete",
        "core.store.dispose",
        "core.store.get",
        "core.store.on-dispose",
        "core.store.reset",
        "core.store.scope",
        "core.store.set",
        "core.store.sub",
        "core.store.txn",
        "core.store.update",
        "core.subscriber-notification-error",
        "core.structural-query",
        "core.invalid-external-cleanup-error",
        "core.transaction-closed-error",
        "core.transaction.delete",
        "core.transaction.get",
        "core.transaction.on-commit",
        "core.transaction.reset",
        "core.transaction.reset-all",
        "core.transaction.scope",
        "core.transaction.set",
        "core.transaction.update",
        "core.transaction-phase-error",
        "core.undefined-collection-value-error",
        "core.type.atom",
        "core.type.atom-options",
        "core.type.collection",
        "core.type.collection-event",
        "core.type.collection-key",
        "core.type.collection-options",
        "core.type.collection-row",
        "core.type.collection-value",
        "core.type.equal-func",
        "core.type.family-key",
        "core.type.get-value",
        "core.type.selector",
        "core.type.selector-options",
        "core.type.state",
        "core.type.store",
        "core.type.store-options",
        "core.type.subscribe-fn",
        "core.type.transaction",
        "core.type.transaction-fn",
        "legacy.adapter-selector-error",
        "legacy.adapter-transaction",
        "legacy.atom-default-value",
        "legacy.atom-lifecycle",
        "legacy.cache-reactive",
        "legacy.deep-freeze",
        "legacy.family-membership-index",
        "legacy.initialize",
        "legacy.mutation-type-aliases",
        "legacy.predicates",
        "legacy.promise-writes",
        "legacy.provider-initialize",
        "legacy.react-initialize-type",
        "legacy.react-store-context",
        "legacy.scope-leases",
        "legacy.scoped-store-txn",
        "legacy.scoped-transaction-types",
        "legacy.selector-get-options",
        "legacy.store-adapter",
        "legacy.store-identity",
        "legacy.store-mode-options",
        "legacy.store-on-commit-end",
        "legacy.store-scope-callback",
        "legacy.store-unset",
        "legacy.subscription-deep-equality",
        "legacy.transaction-interface",
        "legacy.transaction-parent-scope",
        "legacy.transaction-unset",
        "legacy.unset-all",
        "moved.inspect",
        "moved.schema",
        "moved.transfer",
        "react.provider",
        "react.provider.children",
        "react.provider.store",
        "react.scope",
        "react.use-atom",
        "react.use-reset-atom",
        "react.use-set-atom",
        "react.use-store",
        "react.use-transaction",
        "react.use-update-atom",
        "react.use-valdres-callback",
        "react.use-value",
        "core.type.external-source",
        "core.type.external-atom",
        "core.type.external-atom-options",
        "core.invalid-synchronous-external-snapshot-error",
        "core.external-source-operation-error"
    ],
    "callbackIds": [
        "callback.adapter-subscriber",
        "callback.atom-comparator",
        "callback.atom-lazy-initializer",
        "callback.atom-update",
        "callback.beta-cache-loader",
        "callback.collection-encode-key",
        "callback.collection-index-extractor",
        "callback.collection-row-update",
        "callback.external-cleanup",
        "callback.external-get-server-snapshot",
        "callback.external-get-snapshot",
        "callback.external-subscribe",
        "callback.family-create-node",
        "callback.family-encode-key",
        "callback.materialization-status-listener",
        "callback.selector-comparator",
        "callback.selector-getter",
        "callback.store-sub-settle",
        "callback.store-subscriber",
        "callback.transaction",
        "callback.transaction-on-commit",
        "callback.transaction-scope"
    ],
    "independentBetaPublicApiIds": [
        "beta.cache-companion",
        "beta.inspect-flight-recorder",
        "beta.inspect-react-correlation",
        "beta.search"
    ],
    "frozenPublicCoordinates": [
        {
            "id": "adapter.assert-store",
            "kind": "runtime-export",
            "package": "valdres",
            "subpath": "./adapter-internals/v1",
            "name": "assertStore"
        },
        {
            "id": "adapter.read",
            "kind": "runtime-export",
            "package": "valdres",
            "subpath": "./adapter-internals/v1",
            "name": "read"
        },
        {
            "id": "adapter.read-hydration-snapshot",
            "kind": "runtime-export",
            "package": "valdres",
            "subpath": "./adapter-internals/v1",
            "name": "readHydrationSnapshot"
        },
        {
            "id": "adapter.subscribe",
            "kind": "runtime-export",
            "package": "valdres",
            "subpath": "./adapter-internals/v1",
            "name": "subscribe"
        },
        {
            "id": "adapter.v1-subpath",
            "kind": "subpath",
            "package": "valdres",
            "subpath": "./adapter-internals/v1",
            "name": "valdres/adapter-internals/v1"
        },
        {
            "id": "beta.inspect-flight-recorder",
            "kind": "subpath",
            "package": "valdres",
            "subpath": "./inspect",
            "name": "valdres/inspect"
        },
        {
            "id": "beta.inspect-react-correlation",
            "kind": "subpath",
            "package": "valdres-react",
            "subpath": "./inspect",
            "name": "valdres-react/inspect"
        },
        {
            "id": "beta.search",
            "kind": "package",
            "package": "@valdres/search",
            "subpath": ".",
            "name": "@valdres/search"
        },
        {
            "id": "collection.artifact-export",
            "kind": "runtime-export",
            "package": "valdres",
            "subpath": "./collection/artifacts",
            "name": "exportArtifact"
        },
        {
            "id": "collection.artifact-import",
            "kind": "runtime-export",
            "package": "valdres",
            "subpath": "./collection/artifacts",
            "name": "importArtifact"
        },
        {
            "id": "collection.artifacts-subpath",
            "kind": "subpath",
            "package": "valdres",
            "subpath": "./collection/artifacts",
            "name": "valdres/collection/artifacts"
        },
        {
            "id": "collection.materialization-status",
            "kind": "runtime-export",
            "package": "valdres",
            "subpath": "./collection",
            "name": "getMaterializationStatus"
        },
        {
            "id": "collection.materialization-subscribe",
            "kind": "runtime-export",
            "package": "valdres",
            "subpath": "./collection",
            "name": "subscribeMaterialization"
        },
        {
            "id": "collection.materialize",
            "kind": "runtime-export",
            "package": "valdres",
            "subpath": "./collection",
            "name": "materialize"
        },
        {